{
  "id": "m3-01-square-roots",
  "grade": "middle-3",
  "domain": "수와 연산",
  "order": 17,
  "titleKo": "제곱근과 실수·무리수의 성질",
  "titleEn": "Square Roots, Real Numbers, and Irrational Numbers",
  "animation": {
    "type": "svg-animation",
    "title": "제곱근과 실수·무리수의 성질 - 대수적 구조와 변환 다이어그램",
    "caption": "수식의 변수와 계수 간의 상호작용 및 균형 관계를 시각화하여 대수적 연산의 불변 원리를 체득합니다.",
    "svgTemplate": "<svg xmlns='http://www.w3.org/2000/svg' viewBox='0 0 600 340' width='100%' height='100%' style='background:#0f172a; font-family:sans-serif;'>\n  <style>\n    @keyframes spinWheel { 0% { transform: rotate(0deg); } 100% { transform: rotate(360deg); } }\n    .rot-hub { transform-origin: 300px 170px; animation: spinWheel 12s linear infinite; }\n  </style>\n  <text x='300' y='30' fill='#f8fafc' font-size='16' font-weight='bold' text-anchor='middle'>제곱근과 실수·무리수의 성질의 구조적 모델</text>\n  <circle cx='300' cy='170' r='90' fill='rgba(30, 41, 59, 0.8)' stroke='#38bdf8' stroke-width='2.5'/>\n  <g class='rot-hub'>\n    <circle cx='300' cy='80' r='18' fill='#0284c7'/>\n    <circle cx='300' cy='260' r='18' fill='#0284c7'/>\n    <circle cx='210' cy='170' r='18' fill='#f43f5e'/>\n    <circle cx='390' cy='170' r='18' fill='#10b981'/>\n    <line x1='300' y1='80' x2='300' y2='260' stroke='#94a3b8' stroke-width='1.5'/>\n    <line x1='210' y1='170' x2='390' y2='170' stroke='#94a3b8' stroke-width='1.5'/>\n  </g>\n  <text x='300' y='175' fill='#fbbf24' font-weight='bold' font-size='14' text-anchor='middle'>수학적 불변량</text>\n</svg>"
  },
  "concept": {
    "corePrinciple": "제곱근과 실수·무리수의 성질의 핵심은 구체적인 산술적 계산에서 추상적인 기호와 수학적 관계를 파악하여 일반화하는 것입니다. 수의 체계와 대수적 방정식, 기하학적 도형의 성질을 체계적으로 연결합니다.",
    "intuitiveStory": "일상생활에서 사탕을 공평하게 나누어 담거나, 지도를 보고 거리를 측정하거나, 쇼핑할 때 할인율을 계산하는 모든 행위가 바로 이 제곱근과 실수·무리수의 성질의 원리를 바탕으로 작동합니다. 복잡해 보이는 현실의 문제를 수학적 기호와 공식이라는 렌즈를 통해 단순하고 명쾌하게 정리할 수 있습니다.",
    "keyTerms": [
      {
        "termKo": "제곱근과",
        "termEn": "Square",
        "definition": "제곱근과 실수·무리수의 성질에서 가장 기초가 되며 모든 연산과 논리 전개의 바탕이 되는 핵심 수학적 대상입니다."
      },
      {
        "termKo": "연산과 항등",
        "termEn": "Operation & Identity",
        "definition": "수학적 식의 좌변과 우변이 언제나 동일한 가치를 유지하도록 하는 보존 규칙입니다."
      },
      {
        "termKo": "변수와 관계식",
        "termEn": "Variable & Relation",
        "definition": "상황에 따라 변하는 양을 문자로 표현하고, 두 양 사이의 규칙성을 방정식이나 함수로 나타낸 식입니다."
      }
    ]
  },
  "formulas": [
    {
      "nameKo": "피타고라스 정리",
      "nameEn": "Pythagorean Theorem",
      "typesetMath": "a^2 + b^2 = c^2",
      "howToReadEn": "a squared plus b squared equals c squared",
      "explanation": "직각삼각형에서 직각을 낀 두 변의 길이의 제곱의 합은 빗변의 길이의 제곱과 같습니다."
    }
  ],
  "problems": [
    {
      "problemNumber": 1,
      "difficultyLevel": 1,
      "title": "제곱근과 실수·무리수의 성질 핵심 연습문제 1 (난이도 1단계)",
      "question": "다음 제곱근과 실수·무리수의 성질에 관련된 수학적 조건이 주어졌을 때 미지수 또는 참인 값을 구하시오. (조건: 공식 $a^2 + b^2 = c^2$ 적용, 단계 $k = 1$)",
      "visualHint": "문제의 조건을 수학적 기호로 정리하고 공식 [피타고라스 정리]의 성질을 대입하여 단계별로 단순화하세요.",
      "stepByStepSolution": [
        "1단계: 문제에서 주어진 핵심 조건과 변수를 파악합니다 (문제 레벨 1).",
        "2단계: 피타고라스 정리인 $a^2 + b^2 = c^2$을(를) 연계하여 방정식을 세웁니다.",
        "3단계: 양변의 동류항을 정리하고 계산을 단계적으로 전개합니다 (중간값 도출: 단계 1 연산).",
        "4단계: 계산된 결과가 문제의 정의 조건(예: 자연수, 양수 조건 등)에 부합하는지 검증합니다.",
        "5단계: 정리된 해를 구합니다."
      ],
      "finalAnswer": "5",
      "pitfallAndTips": "부호 계산 실수나 분모가 0이 되는 특수 조건을 놓치지 않도록 검산하세요."
    },
    {
      "problemNumber": 2,
      "difficultyLevel": 1,
      "title": "제곱근과 실수·무리수의 성질 핵심 연습문제 2 (난이도 1단계)",
      "question": "다음 제곱근과 실수·무리수의 성질에 관련된 수학적 조건이 주어졌을 때 미지수 또는 참인 값을 구하시오. (조건: 공식 $a^2 + b^2 = c^2$ 적용, 단계 $k = 2$)",
      "visualHint": "문제의 조건을 수학적 기호로 정리하고 공식 [피타고라스 정리]의 성질을 대입하여 단계별로 단순화하세요.",
      "stepByStepSolution": [
        "1단계: 문제에서 주어진 핵심 조건과 변수를 파악합니다 (문제 레벨 1).",
        "2단계: 피타고라스 정리인 $a^2 + b^2 = c^2$을(를) 연계하여 방정식을 세웁니다.",
        "3단계: 양변의 동류항을 정리하고 계산을 단계적으로 전개합니다 (중간값 도출: 단계 2 연산).",
        "4단계: 계산된 결과가 문제의 정의 조건(예: 자연수, 양수 조건 등)에 부합하는지 검증합니다.",
        "5단계: 정리된 해를 구합니다."
      ],
      "finalAnswer": "8",
      "pitfallAndTips": "부호 계산 실수나 분모가 0이 되는 특수 조건을 놓치지 않도록 검산하세요."
    },
    {
      "problemNumber": 3,
      "difficultyLevel": 2,
      "title": "제곱근과 실수·무리수의 성질 핵심 연습문제 3 (난이도 2단계)",
      "question": "다음 제곱근과 실수·무리수의 성질에 관련된 수학적 조건이 주어졌을 때 미지수 또는 참인 값을 구하시오. (조건: 공식 $a^2 + b^2 = c^2$ 적용, 단계 $k = 3$)",
      "visualHint": "문제의 조건을 수학적 기호로 정리하고 공식 [피타고라스 정리]의 성질을 대입하여 단계별로 단순화하세요.",
      "stepByStepSolution": [
        "1단계: 문제에서 주어진 핵심 조건과 변수를 파악합니다 (문제 레벨 2).",
        "2단계: 피타고라스 정리인 $a^2 + b^2 = c^2$을(를) 연계하여 방정식을 세웁니다.",
        "3단계: 양변의 동류항을 정리하고 계산을 단계적으로 전개합니다 (중간값 도출: 단계 3 연산).",
        "4단계: 계산된 결과가 문제의 정의 조건(예: 자연수, 양수 조건 등)에 부합하는지 검증합니다.",
        "5단계: 정리된 해를 구합니다."
      ],
      "finalAnswer": "11",
      "pitfallAndTips": "부호 계산 실수나 분모가 0이 되는 특수 조건을 놓치지 않도록 검산하세요."
    },
    {
      "problemNumber": 4,
      "difficultyLevel": 2,
      "title": "제곱근과 실수·무리수의 성질 핵심 연습문제 4 (난이도 2단계)",
      "question": "다음 제곱근과 실수·무리수의 성질에 관련된 수학적 조건이 주어졌을 때 미지수 또는 참인 값을 구하시오. (조건: 공식 $a^2 + b^2 = c^2$ 적용, 단계 $k = 4$)",
      "visualHint": "문제의 조건을 수학적 기호로 정리하고 공식 [피타고라스 정리]의 성질을 대입하여 단계별로 단순화하세요.",
      "stepByStepSolution": [
        "1단계: 문제에서 주어진 핵심 조건과 변수를 파악합니다 (문제 레벨 2).",
        "2단계: 피타고라스 정리인 $a^2 + b^2 = c^2$을(를) 연계하여 방정식을 세웁니다.",
        "3단계: 양변의 동류항을 정리하고 계산을 단계적으로 전개합니다 (중간값 도출: 단계 4 연산).",
        "4단계: 계산된 결과가 문제의 정의 조건(예: 자연수, 양수 조건 등)에 부합하는지 검증합니다.",
        "5단계: 정리된 해를 구합니다."
      ],
      "finalAnswer": "14",
      "pitfallAndTips": "부호 계산 실수나 분모가 0이 되는 특수 조건을 놓치지 않도록 검산하세요."
    },
    {
      "problemNumber": 5,
      "difficultyLevel": 3,
      "title": "제곱근과 실수·무리수의 성질 핵심 연습문제 5 (난이도 3단계)",
      "question": "다음 제곱근과 실수·무리수의 성질에 관련된 수학적 조건이 주어졌을 때 미지수 또는 참인 값을 구하시오. (조건: 공식 $a^2 + b^2 = c^2$ 적용, 단계 $k = 5$)",
      "visualHint": "문제의 조건을 수학적 기호로 정리하고 공식 [피타고라스 정리]의 성질을 대입하여 단계별로 단순화하세요.",
      "stepByStepSolution": [
        "1단계: 문제에서 주어진 핵심 조건과 변수를 파악합니다 (문제 레벨 3).",
        "2단계: 피타고라스 정리인 $a^2 + b^2 = c^2$을(를) 연계하여 방정식을 세웁니다.",
        "3단계: 양변의 동류항을 정리하고 계산을 단계적으로 전개합니다 (중간값 도출: 단계 5 연산).",
        "4단계: 계산된 결과가 문제의 정의 조건(예: 자연수, 양수 조건 등)에 부합하는지 검증합니다.",
        "5단계: 정리된 해를 구합니다."
      ],
      "finalAnswer": "17",
      "pitfallAndTips": "부호 계산 실수나 분모가 0이 되는 특수 조건을 놓치지 않도록 검산하세요."
    },
    {
      "problemNumber": 6,
      "difficultyLevel": 3,
      "title": "제곱근과 실수·무리수의 성질 핵심 연습문제 6 (난이도 3단계)",
      "question": "다음 제곱근과 실수·무리수의 성질에 관련된 수학적 조건이 주어졌을 때 미지수 또는 참인 값을 구하시오. (조건: 공식 $a^2 + b^2 = c^2$ 적용, 단계 $k = 6$)",
      "visualHint": "문제의 조건을 수학적 기호로 정리하고 공식 [피타고라스 정리]의 성질을 대입하여 단계별로 단순화하세요.",
      "stepByStepSolution": [
        "1단계: 문제에서 주어진 핵심 조건과 변수를 파악합니다 (문제 레벨 3).",
        "2단계: 피타고라스 정리인 $a^2 + b^2 = c^2$을(를) 연계하여 방정식을 세웁니다.",
        "3단계: 양변의 동류항을 정리하고 계산을 단계적으로 전개합니다 (중간값 도출: 단계 6 연산).",
        "4단계: 계산된 결과가 문제의 정의 조건(예: 자연수, 양수 조건 등)에 부합하는지 검증합니다.",
        "5단계: 정리된 해를 구합니다."
      ],
      "finalAnswer": "20",
      "pitfallAndTips": "부호 계산 실수나 분모가 0이 되는 특수 조건을 놓치지 않도록 검산하세요."
    },
    {
      "problemNumber": 7,
      "difficultyLevel": 3,
      "title": "제곱근과 실수·무리수의 성질 핵심 연습문제 7 (난이도 3단계)",
      "question": "다음 제곱근과 실수·무리수의 성질에 관련된 수학적 조건이 주어졌을 때 미지수 또는 참인 값을 구하시오. (조건: 공식 $a^2 + b^2 = c^2$ 적용, 단계 $k = 7$)",
      "visualHint": "문제의 조건을 수학적 기호로 정리하고 공식 [피타고라스 정리]의 성질을 대입하여 단계별로 단순화하세요.",
      "stepByStepSolution": [
        "1단계: 문제에서 주어진 핵심 조건과 변수를 파악합니다 (문제 레벨 3).",
        "2단계: 피타고라스 정리인 $a^2 + b^2 = c^2$을(를) 연계하여 방정식을 세웁니다.",
        "3단계: 양변의 동류항을 정리하고 계산을 단계적으로 전개합니다 (중간값 도출: 단계 7 연산).",
        "4단계: 계산된 결과가 문제의 정의 조건(예: 자연수, 양수 조건 등)에 부합하는지 검증합니다.",
        "5단계: 정리된 해를 구합니다."
      ],
      "finalAnswer": "23",
      "pitfallAndTips": "부호 계산 실수나 분모가 0이 되는 특수 조건을 놓치지 않도록 검산하세요."
    },
    {
      "problemNumber": 8,
      "difficultyLevel": 4,
      "title": "제곱근과 실수·무리수의 성질 핵심 연습문제 8 (난이도 4단계)",
      "question": "다음 제곱근과 실수·무리수의 성질에 관련된 수학적 조건이 주어졌을 때 미지수 또는 참인 값을 구하시오. (조건: 공식 $a^2 + b^2 = c^2$ 적용, 단계 $k = 8$)",
      "visualHint": "문제의 조건을 수학적 기호로 정리하고 공식 [피타고라스 정리]의 성질을 대입하여 단계별로 단순화하세요.",
      "stepByStepSolution": [
        "1단계: 문제에서 주어진 핵심 조건과 변수를 파악합니다 (문제 레벨 4).",
        "2단계: 피타고라스 정리인 $a^2 + b^2 = c^2$을(를) 연계하여 방정식을 세웁니다.",
        "3단계: 양변의 동류항을 정리하고 계산을 단계적으로 전개합니다 (중간값 도출: 단계 8 연산).",
        "4단계: 계산된 결과가 문제의 정의 조건(예: 자연수, 양수 조건 등)에 부합하는지 검증합니다.",
        "5단계: 정리된 해를 구합니다."
      ],
      "finalAnswer": "26",
      "pitfallAndTips": "부호 계산 실수나 분모가 0이 되는 특수 조건을 놓치지 않도록 검산하세요."
    },
    {
      "problemNumber": 9,
      "difficultyLevel": 4,
      "title": "제곱근과 실수·무리수의 성질 핵심 연습문제 9 (난이도 4단계)",
      "question": "다음 제곱근과 실수·무리수의 성질에 관련된 수학적 조건이 주어졌을 때 미지수 또는 참인 값을 구하시오. (조건: 공식 $a^2 + b^2 = c^2$ 적용, 단계 $k = 9$)",
      "visualHint": "문제의 조건을 수학적 기호로 정리하고 공식 [피타고라스 정리]의 성질을 대입하여 단계별로 단순화하세요.",
      "stepByStepSolution": [
        "1단계: 문제에서 주어진 핵심 조건과 변수를 파악합니다 (문제 레벨 4).",
        "2단계: 피타고라스 정리인 $a^2 + b^2 = c^2$을(를) 연계하여 방정식을 세웁니다.",
        "3단계: 양변의 동류항을 정리하고 계산을 단계적으로 전개합니다 (중간값 도출: 단계 9 연산).",
        "4단계: 계산된 결과가 문제의 정의 조건(예: 자연수, 양수 조건 등)에 부합하는지 검증합니다.",
        "5단계: 정리된 해를 구합니다."
      ],
      "finalAnswer": "29",
      "pitfallAndTips": "부호 계산 실수나 분모가 0이 되는 특수 조건을 놓치지 않도록 검산하세요."
    },
    {
      "problemNumber": 10,
      "difficultyLevel": 5,
      "title": "제곱근과 실수·무리수의 성질 핵심 연습문제 10 (난이도 5단계)",
      "question": "다음 제곱근과 실수·무리수의 성질에 관련된 수학적 조건이 주어졌을 때 미지수 또는 참인 값을 구하시오. (조건: 공식 $a^2 + b^2 = c^2$ 적용, 단계 $k = 10$)",
      "visualHint": "문제의 조건을 수학적 기호로 정리하고 공식 [피타고라스 정리]의 성질을 대입하여 단계별로 단순화하세요.",
      "stepByStepSolution": [
        "1단계: 문제에서 주어진 핵심 조건과 변수를 파악합니다 (문제 레벨 5).",
        "2단계: 피타고라스 정리인 $a^2 + b^2 = c^2$을(를) 연계하여 방정식을 세웁니다.",
        "3단계: 양변의 동류항을 정리하고 계산을 단계적으로 전개합니다 (중간값 도출: 단계 10 연산).",
        "4단계: 계산된 결과가 문제의 정의 조건(예: 자연수, 양수 조건 등)에 부합하는지 검증합니다.",
        "5단계: 정리된 해를 구합니다."
      ],
      "finalAnswer": "32",
      "pitfallAndTips": "부호 계산 실수나 분모가 0이 되는 특수 조건을 놓치지 않도록 검산하세요."
    }
  ]
}